Speaker,Display Image url,Title,Location,Attended Event,All Videos,Slide Decks,Linkedin,Twitter,Facebook,Website
Josh Clark,https://web.archive.org/web/20171117230616im_/https://d8142femxnlg1.cloudfront.net/cropped-profile-photos/78c90adbb5be569b7b2f31a9c35f902d10687fac-s48.jpeg,"Designer,mobilemaven,11thstrongestmaninMaine,authorofTapworthy,Couchto5Kcreator,sweetheart(@LizaK).","Brooklyn , United States","{('Name', 'City,Country', 'Date'): [['Pixel Up!', '8th–10th May 2017', '  South Africa  South Africa,  Cape Town ', 'Interaction17', '4th–8th February 2017', '  United States  United States,  New York ', 'Web Directions 2016', '10th–11th November 2016', '  Australia  Australia,  Sydney ', 'An Event Apart Orlando: Special Edition 2016', '3rd–5th October 2016', '  United States  United States,  Orlando ', 'SmashingConf New York 2016', '14th–15th June 2016', '  United States  United States,  New York ']]}","{('Title', 'Url', 'Event Name'): [[""Webstock '14: Josh Clark - Mind the Gap: Designing in the Space Between Devices"", 'https://web.archive.org/web/20170825093649/https://vimeo.com/89810578', 'Mind the Gap: Designing the space between devices', 'UX Week 2014 | The Web Gets Real: Designing for the Internet of Things', 'https://web.archive.org/web/20170825093649/https://vimeo.com/107190231', 'Beyond Mobile - Josh Clark', 'https://web.archive.org/web/20170825093649/https://vimeo.com/77201865', 'The Web Gets Real: Designing for the Internet of Things', 'Beyond Mobile | Web Directions', 'https://web.archive.org/web/20170825093649/http://www.webdirections.org/resources/beyond-mobile-video-presentation-from-josh-clark/', 'Josh Clark, Beyond Mobile: Where No Geek Has Gone Before - Mobilism 2013, Day 1, Afternoon, Speaker 8', 'https://web.archive.org/web/20170825093649/http://vimeo.com/68935393', 'Beyond Mobile: Where No Geek Has Gone Before', 'Buttons are a hack | Josh Clark Video presentation', 'https://web.archive.org/web/20170825093649/http://www.webdirections.org/resources/buttons-are-a-hack-presentation-video-from-josh-clark/', 'Josh Clark - The Seven Deadly Myths of Mobile - BDConf, April 2012', 'https://web.archive.org/web/20170825093649/http://vimeo.com/48327889', 'Beyond Mobile: where no geek has gone before', 'Keynote: Where No Geek Has Gone Before', 'https://web.archive.org/web/20170825093649/http://www.youtube.com/watch?v=BJ7Hd9aWmQc', 'Josh Clark - Buttons are a Hack: The New Rules of Designing for Touch - BD Conf, Sept 2011', 'https://web.archive.org/web/20170825093649/https://vimeo.com/36014698', 'Beyond Mobile: Where No Geek Has Gone Before', 'Mobil-nority Report: The next five years', 'https://web.archive.org/web/20170825093649/http://vimeo.com/31764295', 'Touching news: The new rules of tablet media', 'https://web.archive.org/web/20170825093649/http://vimeo.com/31764278', 'Buttons Are a Hack', 'Josh Clark: ""Teaching Touch""', 'https://web.archive.org/web/20170825093649/http://swipeconference.eventer.com/talks/1012', ""Webstock '11: Josh Clark - Buttons Are a Hack: The New Rules of Designing for Touch"", 'https://web.archive.org/web/20170825093649/http://vimeo.com/21796111', 'The Seven Deadly Myths of Mobile', 'Chariot Screencast: Buttons are a hack', 'https://web.archive.org/web/20170825093649/http://screencasts.chariotsolutions.com/1-2', ""O'Reilly Webcast: Tapworthy - Designing iPhone Interfaces for Delight and Usability"", 'https://web.archive.org/web/20170825093649/http://www.youtube.com/watch?v=_JobmIurqCY', 'Beyond Mobile: Where No Geek Has Gone Before', 'Going Native: The Anthropology of Mobile App Design', 'https://web.archive.org/web/20170825093649/http://vimeo.com/16226975', 'Brian Jepson interviews Josh Clark at the October 2010 Providence Geek Dinner', 'https://web.archive.org/web/20170825093649/http://blip.tv/file/4286464', 'Buttons are a hack: The new rules of designing for touch']]}","Making a Splash With Your Open Source Project , DjangoCon US 2016, 17th-22nd July 2016, https://web.archive.org/web/20171117230609/https://speakerdeck.com/freakboy3742/making-a-splash-with-your-open-source-project",https://web.archive.org/web/20171206133935/http://www.linkedin.com/in/joshclark,https://web.archive.org/web/20171206133935/http://twitter.com/bigmediumjosh,,https://web.archive.org/web/20171117230616/http://lanyrd.com/profile/globalmoxie/
Tom Chatfield,https://web.archive.org/web/20171117230616im_/https://s3.amazonaws.com/static.lanyrd.net/cropped-profile-photos/979c1e4314f1b76ef749299724776178a8bec107-s48.jpg,Independent designer; GIF sommelier. Started that whole “responsive web design” thing. (@RWD) Has a bukk.it. ⭐️ &gt; ❤️.,,"{('Name', 'City,Country', 'Date'): [['Thinking Digital Manchester', '2nd–3rd November 2015', '  England  England,  Manchester ', 'SXSE London 2014', '24th November 2014', '  England  England,  London ', 'Economist Technology Frontiers 2013', '5th–6th March 2013', '  England  England,  London ', 'X Media Lab Switzerland ""Participation Culture"" 2012', '14th–16th September 2012', '  Switzerland  Switzerland,  Basel-City ', 'Thinking Digital 2012', '29th–31st May 2012', '  England  England,  Gateshead ']]}","{('Title', 'Url', 'Event Name'): [[""Webstock '14: Josh Clark - Mind the Gap: Designing in the Space Between Devices"", 'https://web.archive.org/web/20170825093649/https://vimeo.com/89810578', 'Mind the Gap: Designing the space between devices', 'UX Week 2014 | The Web Gets Real: Designing for the Internet of Things', 'https://web.archive.org/web/20170825093649/https://vimeo.com/107190231', 'Beyond Mobile - Josh Clark', 'https://web.archive.org/web/20170825093649/https://vimeo.com/77201865', 'The Web Gets Real: Designing for the Internet of Things', 'Beyond Mobile | Web Directions', 'https://web.archive.org/web/20170825093649/http://www.webdirections.org/resources/beyond-mobile-video-presentation-from-josh-clark/', 'Josh Clark, Beyond Mobile: Where No Geek Has Gone Before - Mobilism 2013, Day 1, Afternoon, Speaker 8', 'https://web.archive.org/web/20170825093649/http://vimeo.com/68935393', 'Beyond Mobile: Where No Geek Has Gone Before', 'Buttons are a hack | Josh Clark Video presentation', 'https://web.archive.org/web/20170825093649/http://www.webdirections.org/resources/buttons-are-a-hack-presentation-video-from-josh-clark/', 'Josh Clark - The Seven Deadly Myths of Mobile - BDConf, April 2012', 'https://web.archive.org/web/20170825093649/http://vimeo.com/48327889', 'Beyond Mobile: where no geek has gone before', 'Keynote: Where No Geek Has Gone Before', 'https://web.archive.org/web/20170825093649/http://www.youtube.com/watch?v=BJ7Hd9aWmQc', 'Josh Clark - Buttons are a Hack: The New Rules of Designing for Touch - BD Conf, Sept 2011', 'https://web.archive.org/web/20170825093649/https://vimeo.com/36014698', 'Beyond Mobile: Where No Geek Has Gone Before', 'Mobil-nority Report: The next five years', 'https://web.archive.org/web/20170825093649/http://vimeo.com/31764295', 'Touching news: The new rules of tablet media', 'https://web.archive.org/web/20170825093649/http://vimeo.com/31764278', 'Buttons Are a Hack', 'Josh Clark: ""Teaching Touch""', 'https://web.archive.org/web/20170825093649/http://swipeconference.eventer.com/talks/1012', ""Webstock '11: Josh Clark - Buttons Are a Hack: The New Rules of Designing for Touch"", 'https://web.archive.org/web/20170825093649/http://vimeo.com/21796111', 'The Seven Deadly Myths of Mobile', 'Chariot Screencast: Buttons are a hack', 'https://web.archive.org/web/20170825093649/http://screencasts.chariotsolutions.com/1-2', ""O'Reilly Webcast: Tapworthy - Designing iPhone Interfaces for Delight and Usability"", 'https://web.archive.org/web/20170825093649/http://www.youtube.com/watch?v=_JobmIurqCY', 'Beyond Mobile: Where No Geek Has Gone Before', 'Going Native: The Anthropology of Mobile App Design', 'https://web.archive.org/web/20170825093649/http://vimeo.com/16226975', 'Brian Jepson interviews Josh Clark at the October 2010 Providence Geek Dinner', 'https://web.archive.org/web/20170825093649/http://blip.tv/file/4286464', 'Buttons are a hack: The new rules of designing for touch']]}","Things your mother didn't teach you about sharing your toys , DjangoCon US 2016, 17th-22nd July 2016, https://web.archive.org/web/20171117230609/https://speakerdeck.com/freakboy3742/things-your-parents-didnt-teach-you-about-sharing-your-toys",,https://web.archive.org/web/20170824180357/http://twitter.com/TomChatfield,,https://web.archive.org/web/20171117230616/http://lanyrd.com/profile/tomchatfield/
Werner Vogels,https://web.archive.org/web/20171117230616im_/https://d8142femxnlg1.cloudfront.net/cropped-profile-photos/742b055c2eaa2cc37fe7e7cd1b9e98e11b0dd879-s48.jpg,Independent designer; GIF sommelier. Started that whole “responsive web design” thing. (@RWD) Has a bukk.it. ⭐️ &gt; ❤️.,,"{('Name', 'City,Country', 'Date'): [['Box Hack Day', '6th–8th September 2016', '  United States  United States,  San Francisco ', 'AWS Summit New York 2016', '10th–11th August 2016', '  United States  United States,  New York ', 'TNW Conference Europe 2016', '26th–27th May 2016', '  Netherlands  Netherlands,  Amsterdam ', 'Gigaom Structure 2015', '17th–18th June 2015', '  United States  United States,  San Francisco ', 'Signal', '19th–20th May 2015', '  United States  United States,  San Francisco ']]}","{('Title', 'Url', 'Event Name'): [['Werner Vogels @ tnw2012 CxOSummit', 'https://web.archive.org/web/20170824220509/http://www.youtube.com/watch?v=GlT8f9NssxY', 'The Lean Cloud, making Enterprises succeed in an Agile World', ""LISA '09 Opening Remarks & Awards Video"", 'https://web.archive.org/web/20170824220509/http://www.usenix.org/events/lisa09/stream1/opening.html', ""Amazon's Werner Vogels at Dublin Web Summit"", 'https://web.archive.org/web/20170824220509/http://www.youtube.com/watch?v=xrAanHRut74', 'Ahead in the Cloud: The Power of Infrastructure as a Service', 'Strata 2011:  Werner Vogels, ""Data Without Limits""', 'https://web.archive.org/web/20170824220509/http://www.youtube.com/watch?v=oNTp5spjv0w']]}","From Mobile First to Offline First , Th, Conference 2016, 8th-10th August 2016, https://web.archive.org/web/20171117230609/https://speakerdeck.com/bradleyholt/from-mobile-first-to-offline-first-at-that-conference",,https://web.archive.org/web/20170618062703/http://twitter.com/Werner,,https://web.archive.org/web/20171117230616/http://lanyrd.com/profile/werner/
Paul Irish,https://web.archive.org/web/20171117230616im_/https://d8142femxnlg1.cloudfront.net/cropped-profile-photos/92e9bbc791a376d5effa8655e153616f9d72e1e4-s48.jpg,"Iwantthewebtowin•Chromedevrelations•currentlyfascinatedwithfront-endtoolingandbrowserdevtools•bigfanofsorbet,researchandwhimsy","Palo Alto , United States","{('Name', 'City,Country', 'Date'): [['#PerfMatters Conference', '27th–28th March 2018', '  United States  United States,  Redwood City ']]}","{('Title', 'Url', 'Event Name'): [['How Users Perceive the Speed of The Web - Paul Irish (Google) keynote', 'https://web.archive.org/web/20170913104142/http://www.youtube.com/watch?v=2ksXo2_Lfl0', 'How Users Perceive the Speed of The Web', 'DevTools for Mobile - Chrome Dev Summit 2013 (Paul Irish)', 'https://web.archive.org/web/20170913104142/http://www.youtube.com/watch?v=gZH1d2Co1X0', 'Mobile Web Developer Tools', 'https://web.archive.org/web/20170913104142/https://vimeo.com/78331559', 'DevTools for Mobile', 'Google I/O 2013 - Clientside Package Management: Less Work, More Awesome', 'https://web.archive.org/web/20170913104142/http://www.youtube.com/watch?v=o9Xo_WFAyqg', 'Matt Smith', 'Google I/O 2013 - Feature Detection in the Real World', 'https://web.archive.org/web/20170913104142/http://www.youtube.com/watch?v=t1fOAKHTKoM', 'Mobile Web Developer Tools', 'The Modern Workflow for Developing the Mobile Web - Google I/O 2013', 'https://web.archive.org/web/20170913104142/http://www.youtube.com/watch?v=dkOmuyL7ffM', 'Google I/O 2013 - Chrome DevTools Revolutions 2013', 'https://web.archive.org/web/20170913104142/http://www.youtube.com/watch?v=x6qe_kVaBpg', 'Clientside Package Management: Less Work, More Awesome', 'Google I/O 2013 - Fireside Chat with the Blink Team', 'https://web.archive.org/web/20170913104142/http://www.youtube.com/watch?v=WEBeNZ8khS4', 'Paul Irish [En]: Developing HTML5 For a Cross Browser World', 'https://web.archive.org/web/20170913104142/http://vimeo.com/32608242', 'Feature Detection in the Real World', 'Edge Conference - Panel 7: Testing and tooling', 'https://web.archive.org/web/20170913104142/http://www.youtube.com/watch?v=FY5iiuQRyEE', 'TXJS 2011 A8 - Paul Irish - HTML and the DOM', 'https://web.archive.org/web/20170913104142/http://vimeo.com/32287640', 'The Modern Workflow for Developing the Mobile Web', 'Fluent 2012: Paul Irish, ""Javascript Development Workflow of 2013""', 'https://web.archive.org/web/20170913104142/http://www.youtube.com/watch?v=f7AU2Ozu8eo', 'JSConf2012 - Paul Irish', 'https://web.archive.org/web/20170913104142/http://blip.tv/jsconf/jsconf2012-paul-irish-6139707', 'Chrome DevTools Revolutions 2013 ', 'jQuery UK 2012 - App development stack for JS developers - Paul Irish', 'https://web.archive.org/web/20170913104142/http://vimeo.com/40929961', 'JSConf2011 - Paul Irish', 'https://web.archive.org/web/20170913104142/http://blip.tv/jsconf/jsconf2011-paul-irish-5382827', 'Fireside Chat with the Blink Team', 'Google I/O 2011: Chrome Dev Tools Reloaded', 'https://web.archive.org/web/20170913104142/http://www.youtube.com/watch?v=N8SS-rUEZPg', 'Paul Irish on HTML5 Boilerplate', 'https://web.archive.org/web/20170913104142/http://www.youtube.com/watch?v=qyM37XKkmKQ', 'Developing HTML5 For a Cross Browser World', 'Paul Irish - The State of HTML5 : Inaugural Address', 'https://web.archive.org/web/20170913104142/http://blip.tv/file/4293357', 'Paul Irish | The State of HTML5: Inaugural Address | Fronteers 2010', 'https://web.archive.org/web/20170913104142/http://vimeo.com/15988666', 'Testing and tooling']]}","Domain-Driven D,a , Th, Conference 2016, 8th-10th August 2016, https://web.archive.org/web/20171117230609/https://speakerdeck.com/bradleyholt/domain-driven-data-at-that-conference",,https://web.archive.org/web/20171017180326/http://twitter.com/paul_irish,,https://web.archive.org/web/20171117230616/http://lanyrd.com/profile/paul_irish/
Michał Budzyński,https://web.archive.org/web/20171117230616im_/https://d8142femxnlg1.cloudfront.net/cropped-profile-photos/557ae4cc99c5dddc8424e6ad8a20ced8dbc65fd4-s48.jpeg,@Boot2Geckodeveloperat@Mozilla.❤TVSeries&Tabasco.@onGameStart&@AntarcticJSsensei.,"Warsaw , Poland","{('Name', 'City,Country', 'Date'): [['DEVit Conference 2016', '20th May 2016', '  Greece  Greece,  Thessaloniki ', 'jsDay 2015', '13th–14th May 2015', '  Italy  Italy,  Verona ', 'Front-Trends 2015', '6th–8th May 2015', '  Poland  Poland,  Warsaw ', '[canceled] onGameStart 2015', '11th–13th March 2015', '  Poland  Poland,  Warsaw ', 'AntarcticJS', '14th–22nd November 2014', '  Antarctica  Antarctica ']]}","{('Title', 'Url', 'Event Name'): [['Michał Budzyński - JS, JS, are you mad?', 'https://web.archive.org/web/20170910160919/http://www.youtube.com/watch?v=Fwcow-HoX3g', 'JS, JS, are you mad?', ""Keyboard? Mouse? C'mon! It's 2014 - Lightning Talk - Michał Budzyński"", 'https://web.archive.org/web/20170910160919/http://vimeo.com/97308704', 'Michal Budzynski - LXJS2013 - Gaming in JavaScript', 'https://web.archive.org/web/20170910160919/http://www.youtube.com/watch?v=ekvaKmVfjtc', ""Keyboard? Mouse? C'mon! It's 2014!"", 'Michal Budzynski - Opening, history & the current state of HTML5 games', 'https://web.archive.org/web/20170910160919/https://vimeo.com/65545055', 'TakeOff 2013 - The photostory of everything - Michal Budzynski', 'https://web.archive.org/web/20170910160919/http://www.youtube.com/watch?v=4jxkWqSHh98', '[Game.js] Thinking outside the box', ""JSCamp Talk: Michal Budzynski - Yo Mama's So Ugly She Makes Onions Cry"", 'https://web.archive.org/web/20170910160919/http://www.youtube.com/watch?v=vjcxPptZdPA', 'JS.everywhere(Europe) 2012: The Next Console Generation Will Be the Last - Michal Budzynski', 'https://web.archive.org/web/20170910160919/http://www.youtube.com/watch?v=0C85zospch0', 'Opening, history & the current state of HTML5 games', 'Go to hell Flash! We have Open Web! - Michal Budzynski', 'https://web.archive.org/web/20170910160919/https://vimeo.com/49754123', 'Michal Budzynski - Hey Flash, can you do this HTML5 can!', 'https://web.archive.org/web/20170910160919/https://vimeo.com/43334970', 'The photostory of everything', 'Michal Budzynski - BrazilJS 2011', 'https://web.archive.org/web/20170910160919/http://vimeo.com/37859715', 'Michał Budzyński - How not to reinvent the wheel (Game dev)', 'https://web.archive.org/web/20170910160919/http://www.youtube.com/watch?v=IOAR_DLR5C4', ""Yo Mama's So Ugly She Makes Onions Cry - Michal Budzynski"", 'Michał Budzyński', 'https://web.archive.org/web/20170910160919/http://vimeo.com/32360230', 'Michal Budzynski - JAVASCRIPT IN GAME DEVELOPMENT - jsday2011', 'https://web.archive.org/web/20170910160919/http://vimeo.com/30016055', 'The next console generation will be the last', 'Michal Budzynski – Why Do We Need Two Eyes?', 'https://web.archive.org/web/20170910160919/http://blip.tv/jsconfeu/michal-budzynski-why-do-we-need-two-eyes-5647612']]}","From Mobile First to Offline First , Abstractions, 18th-20th August 2016, https://web.archive.org/web/20171117230609/https://speakerdeck.com/bradleyholt/from-mobile-first-to-offline-first-at-abstractions",,https://web.archive.org/web/20171206143520/http://twitter.com/michalbe,,https://web.archive.org/web/20171117230616/http://lanyrd.com/profile/michalbe/
Mike Butcher,https://web.archive.org/web/20171117230616im_/https://d8142femxnlg1.cloudfront.net/cropped-profile-photos/565c8820b1ded4bfc5fccde541680aa3669f66ef-s48.jpg,"EuropeanEditor,@TechCrunch|Co-founder/Adviser,@TechHub|Adviser,@Coadec|WEFMediaLeader|http://t.co/OfZdufxE|http://t.co/m99PgeIn","London , England","{('Name', 'City,Country', 'Date'): [['DOKU:TECH', '6th–7th August 2016', ' Kosovo ', 'Bits & Pretzels 2015', '27th–29th September 2015', '  Germany  Germany,  Munich ', 'Arctic15', '26th–27th May 2015', '  Finland  Finland,  Helsinki ', 'Webrazzi Summit 2014', '25th September 2014', '  Turkey  Turkey,  Istanbul ', 'WORD! Conference, Berlin Music Week 2014', '3rd–7th September 2014', '  Germany  Germany,  Berlin ']]}","{('Title', 'Url', 'Event Name'): [['Yossi Vardi (DLD) - from Main Stage - Dublin Web Summit 2012', 'https://web.archive.org/web/20150924071432/http://new.livestream.com/websummit/DWS12Main/videos/5872006', 'Yossi Vardi and Mike Butcher', 'Dmitry Grishin - Mail.ru - from Main Stage - Dublin Web Summit 2012', 'https://web.archive.org/web/20150924071432/http://new.livestream.com/websummit/DWS12Main/videos/5818203', 'The European Intervention - from Main Stage - Dublin Web Summit 2012', 'https://web.archive.org/web/20150924071432/http://new.livestream.com/websummit/DWS12Main/videos/5784081', 'Dmitry Grishin and Mike Butcher', 'Google - Nikesh Arora - from London Web Summit', 'https://web.archive.org/web/20150924071432/http://new.livestream.com/websummit/LWS/videos/349961', 'Deezer - Axel Dauchez - from London Web Summit', 'https://web.archive.org/web/20150924071432/http://new.livestream.com/websummit/LWS/videos/349957', 'A European Intervention', 'Startup Finalists - from London Web Summit', 'https://web.archive.org/web/20150924071432/http://new.livestream.com/websummit/LWS/videos/349959', 'Atomico - Niklas Zennstrom - from London Web Summit', 'https://web.archive.org/web/20150924071432/http://new.livestream.com/websummit/LWS/videos/349108', 'Google', 'London Web Summit - Introduction - from London Web Summit', 'https://web.archive.org/web/20150924071432/http://new.livestream.com/websummit/LWS/videos/347547', ""Nick D'Aloisio - from London Web Summit"", 'https://web.archive.org/web/20150924071432/http://new.livestream.com/websummit/LWS/videos/347557', 'Deezer', 'Interview: Shak Khan (Spotify) with Mike Butcher (TechCrunch) - from London Web Summit', 'https://web.archive.org/web/20150924071432/http://new.livestream.com/websummit/LWS13/videos/12831806', 'Demo - from London Web Summit', 'https://web.archive.org/web/20150924071432/http://new.livestream.com/websummit/LWS13/videos/12815480', 'Startup Finalists', 'Demo - from London Web Summit', 'https://web.archive.org/web/20150924071432/http://new.livestream.com/websummit/LWS13/videos/12815480', 'Aaron Levie, CEO of Box Takes the Stage at LeWeb London 2012', 'https://web.archive.org/web/20150924071432/http://www.youtube.com/watch?v=G5cY9jsAMpk', 'Atomico', 'Start-Up Clusters in Europe', 'https://web.archive.org/web/20150924071432/http://www.ustream.tv/recorded/19009728', 'VC Panel at Dublin Web Summit', 'https://web.archive.org/web/20150924071432/http://www.youtube.com/watch?v=6EhKJgTnBfI', 'Introduction', 'HDLive - Mike Butcher ""Time to Start Up""', 'https://web.archive.org/web/20150924071432/http://vimeo.com/8079739', 'Mike Butcher @ The Dublin Web Summit', 'https://web.archive.org/web/20150924071432/http://www.youtube.com/watch?v=raUyDeAq52Q', 'Nick Dâ€™Aloisio', 'How To Deal With TechCrunch - And Maybe Other Media - Mike Butcher', 'https://web.archive.org/web/20150924071432/http://vimeo.com/26432513']]}","Heißt Agil “noch weniger Zeit zum Testen”?!? , ASQF Fachgruppentreffen Braunschweig August 2016, 18th August 2016, https://web.archive.org/web/20171117230609/http://www.slideshare.net/AlexSchwartz1/does-agile-mean-having-even-less-time-for-testing",https://web.archive.org/web/20170822175937/http://www.linkedin.com/in/mikebutcher,https://web.archive.org/web/20170822175937/http://twitter.com/mikebutcher,,https://web.archive.org/web/20171117230616/http://lanyrd.com/profile/mikebutcher/
Shervin Pishevar,https://web.archive.org/web/20171117230616im_/https://d8142femxnlg1.cloudfront.net/cropped-profile-photos/e5ded4ee6228f89ef8f834ba00f2aad64168ca33-s48.jpeg,Independent designer; GIF sommelier. Started that whole “responsive web design” thing. (@RWD) Has a bukk.it. ⭐️ &gt; ❤️.,,"{('Name', 'City,Country', 'Date'): [[""LeWeb'13 Paris"", '10th–13th December 2013', '  France  France,  Paris ', 'Dublin Web Summit 2013', '30th–31st October 2013', '  Ireland  Ireland,  Dublin ', 'Start New York 2013', '15th March 2013', '  United States  United States,  New York ', 'SXSW Interactive 2013', '8th–12th March 2013', '  United States  United States,  Austin ', 'Pioneers Festival 2012', '29th–31st October 2012', '  Austria  Austria,  Vienna ']]}","{('Title', 'Url', 'Event Name'): [['Know your enemy: copycats, competitors and partners - from Start New York', 'https://web.archive.org/web/20150403113418/http://new.livestream.com/websummit/nyc2013/videos/13884661', 'Know your enemy: copycats, competitors and partners', 'Panel - Bonfire of the Vanities: Celebrities, Startups & Hype - from London Web Summit', 'https://web.archive.org/web/20150403113418/http://new.livestream.com/websummit/LWS/videos/347550', 'Team Uber vs. Team Hailo - LeWeb London 2012 - Plenary 1', 'https://web.archive.org/web/20150403113418/http://www.youtube.com/watch?v=Og1zTA2feoM', 'Bonfire of the Vanities: Celebrities, Startups and Hype', 'Sean Parker, General Partner, Founders Fund  & Shervin Pishevar, Managing Director, Menlo Ventures', 'https://web.archive.org/web/20150403113418/http://www.ustream.tv/recorded/19027372', 'Big Omaha 2011 - Extended Speaker Q&A', 'https://web.archive.org/web/20150403113418/http://vimeo.com/25749984', 'Team Uber vs. Team Hailo', 'Big Omaha 2011 - Shervin Pishevar of Menlo Ventures', 'https://web.archive.org/web/20150403113418/http://vimeo.com/25388561', '@Angels: Ron Conway (SV Angel), Jeff Clavier (SoftTech VC), Josh Felser (Freestyle Capital), Dave Mc', 'https://web.archive.org/web/20150403113418/http://www.ustream.tv/recorded/17272724', 'Sean Parker & Shervin Pishevar']]}","Hacking the OWASP Juice Shop , OWASP NL Chapter Meeting, 22nd September 2016, https://web.archive.org/web/20171117230609/https://slideshare.net/BjrnKimminich/juice-shop-an-intentionally-insecure-javascript-web-application",,https://web.archive.org/web/20171206143524/http://twitter.com/shervin,,https://web.archive.org/web/20171117230616/http://lanyrd.com/profile/shervin/
Marc Burgauer,https://web.archive.org/web/20171117230616im_/https://d8142femxnlg1.cloudfront.net/cropped-profile-photos/13c5a35a346258dd4f270350f4ef03b06da12dba-s75.png,Independent designer; GIF sommelier. Started that whole “responsive web design” thing. (@RWD) Has a bukk.it. ⭐️ &gt; ❤️.,,"{('Name', 'City,Country', 'Date'): [['GOTO Berlin 2017', '15th–17th November 2017', '  Germany  Germany,  Berlin ']]}","{('Title', 'Url', 'Event Name'): [[]]}","Hacking the OWASP Juice Shop , OWASP NL Chapter Meeting, 22nd September 2016, https://web.archive.org/web/20171117230609/http://bkimminich.github.io/juice-shop/",https://web.archive.org/web/20170910024824/https://www.linkedin.com/pub/marc-burgauer/2/229/a8a,https://web.archive.org/web/20170910024824/http://twitter.com/somesheep,,https://web.archive.org/web/20171117230616/http://lanyrd.com/profile/marc_burgauer/
